{
  "name":"user",
  "version": {
     "value": "0.1",
     "changelog": "Test version"
  },
  "status": {
    "value":"active"
  },
  "datastore":{
    "mongo": {
      "database":"test",
      "collection":"user"
    }
  },
  "fields": {
    "_id": { "type":"string" },
    "object_type":{"type":"string"},
    "login": { 
       "type":"string",
       "constraints": {
         "maxLength":64,
         "minLength":1,
         "required":true
       }
    },
    "password": {
      "type":"object",
      "fields": {
         "hashed": {"type":"string"},
         "salt": {"type":"string"}
      }
    },
    "company": { "type":"string"},
    "greeting": { "type":"string"},
    "firstName": { "type":"string"},
    "lastName":  { "type":"string"},
    "suffix": {"type":"string"},
    "title": {"type":"string"},
    "email": {"type":"string"},
    "emailConfirmed": {"type":"boolean"},
    "phoneNumber": { "type":"string"},
    "faxNumber": { "type":"string"},
    "locale": {"type":"string"},
    "timezone": {"type":"string"},
    "department": {"type":"string"},
    "createdDate": { "type":"date"},
    "updatedDate": {"type":"date"}
  }
}
