{
    "name":"test",
    "version":{
        "value":"1.0",
        "changelog":"Initial version"
    },
    "status":{
        "value":"active"
    },
    "access":{
        "insert":[
            "admin"
        ],
        "find":[
            "admin",
            "all"
        ],
        "update":[
            "admin"
        ],
        "delete":[
            "admin"
        ]
    },
    "constraints":{
        "unique":[
            "name"
        ]
    },
    "datastore":{
        "mongo":{
            "database":"some/identifier",
            "collection":"test"
        }
    },
    "fields":{
        "credentials":{
            "type":"object",
            "fields":{
                "login":{
                    "type":"string",
                    "required":true
                },
                "password":{
                    "type":"string",
                    "required":true
                }
            },
            "required":true
        },
        "address":{
            "type":"array",
            "items":{
                "street":{
                    "type":"array",
                    "items":{
                        "type":"string"
                    },
                    "access":{
                        "read":[
                            "all"
                        ],
                        "write":[
                            "admin"
                        ]
                    },
                    "hooks":{
                        "insert":[
                            "publish"
                        ],
                        "update":[
                            "audit",
                            "publish"
                        ],
                        "delete":[
                            "audit"
                        ]
                    }
                },
                "city":{
                    "type":"string",
                    "access":{
                        "read":[
                            "all"
                        ],
                        "write":[
                            "admin"
                        ]
                    }
                },
                "state":{
                    "type":"string"
                },
                "postalCode":{
                    "type":"string"
                }
            }
        }
    }
}